[
  {
    "exercise_substitution_map_id": "esm_0001",
    "exercise_id": "ex_barbell_bench_press",
    "substitute_exercise_id": "ex_dumbbell_bench_press",
    "substitution_similarity": "same_pattern_and_primary_muscle",
    "reason": "Alternative with different equipment, stability, or joint-loading profile",
    "confidence_rating": "moderate"
  },
  {
    "exercise_substitution_map_id": "esm_0002",
    "exercise_id": "ex_barbell_bench_press",
    "substitute_exercise_id": "ex_machine_chest_press",
    "substitution_similarity": "same_pattern_and_primary_muscle",
    "reason": "Alternative with different equipment, stability, or joint-loading profile",
    "confidence_rating": "moderate"
  },
  {
    "exercise_substitution_map_id": "esm_0003",
    "exercise_id": "ex_barbell_bench_press",
    "substitute_exercise_id": "ex_cable_fly",
    "substitution_similarity": "same_pattern_and_primary_muscle",
    "reason": "Alternative with different equipment, stability, or joint-loading profile",
    "confidence_rating": "moderate"
  },
  {
    "exercise_substitution_map_id": "esm_0004",
    "exercise_id": "ex_dumbbell_bench_press",
    "substitute_exercise_id": "ex_barbell_bench_press",
    "substitution_similarity": "same_pattern_and_primary_muscle",
    "reason": "Alternative with different equipment, stability, or joint-loading profile",
    "confidence_rating": "moderate"
  },
  {
    "exercise_substitution_map_id": "esm_0005",
    "exercise_id": "ex_dumbbell_bench_press",
    "substitute_exercise_id": "ex_machine_chest_press",
    "substitution_similarity": "same_pattern_and_primary_muscle",
    "reason": "Alternative with different equipment, stability, or joint-loading profile",
    "confidence_rating": "moderate"
  },
  {
    "exercise_substitution_map_id": "esm_0006",
    "exercise_id": "ex_dumbbell_bench_press",
    "substitute_exercise_id": "ex_cable_fly",
    "substitution_similarity": "same_pattern_and_primary_muscle",
    "reason": "Alternative with different equipment, stability, or joint-loading profile",
    "confidence_rating": "moderate"
  },
  {
    "exercise_substitution_map_id": "esm_0007",
    "exercise_id": "ex_incline_dumbbell_press",
    "substitute_exercise_id": "ex_incline_machine_press",
    "substitution_similarity": "same_pattern_and_primary_muscle",
    "reason": "Alternative with different equipment, stability, or joint-loading profile",
    "confidence_rating": "moderate"
  },
  {
    "exercise_substitution_map_id": "esm_0008",
    "exercise_id": "ex_incline_dumbbell_press",
    "substitute_exercise_id": "ex_low_to_high_cable_fly",
    "substitution_similarity": "same_pattern_and_primary_muscle",
    "reason": "Alternative with different equipment, stability, or joint-loading profile",
    "confidence_rating": "moderate"
  },
  {
    "exercise_substitution_map_id": "esm_0009",
    "exercise_id": "ex_machine_chest_press",
    "substitute_exercise_id": "ex_barbell_bench_press",
    "substitution_similarity": "same_pattern_and_primary_muscle",
    "reason": "Alternative with different equipment, stability, or joint-loading profile",
    "confidence_rating": "moderate"
  },
  {
    "exercise_substitution_map_id": "esm_0010",
    "exercise_id": "ex_machine_chest_press",
    "substitute_exercise_id": "ex_dumbbell_bench_press",
    "substitution_similarity": "same_pattern_and_primary_muscle",
    "reason": "Alternative with different equipment, stability, or joint-loading profile",
    "confidence_rating": "moderate"
  },
  {
    "exercise_substitution_map_id": "esm_0011",
    "exercise_id": "ex_machine_chest_press",
    "substitute_exercise_id": "ex_cable_fly",
    "substitution_similarity": "same_pattern_and_primary_muscle",
    "reason": "Alternative with different equipment, stability, or joint-loading profile",
    "confidence_rating": "moderate"
  },
  {
    "exercise_substitution_map_id": "esm_0012",
    "exercise_id": "ex_incline_machine_press",
    "substitute_exercise_id": "ex_incline_dumbbell_press",
    "substitution_similarity": "same_pattern_and_primary_muscle",
    "reason": "Alternative with different equipment, stability, or joint-loading profile",
    "confidence_rating": "moderate"
  },
  {
    "exercise_substitution_map_id": "esm_0013",
    "exercise_id": "ex_incline_machine_press",
    "substitute_exercise_id": "ex_low_to_high_cable_fly",
    "substitution_similarity": "same_pattern_and_primary_muscle",
    "reason": "Alternative with different equipment, stability, or joint-loading profile",
    "confidence_rating": "moderate"
  },
  {
    "exercise_substitution_map_id": "esm_0014",
    "exercise_id": "ex_cable_fly",
    "substitute_exercise_id": "ex_barbell_bench_press",
    "substitution_similarity": "same_pattern_and_primary_muscle",
    "reason": "Alternative with different equipment, stability, or joint-loading profile",
    "confidence_rating": "moderate"
  },
  {
    "exercise_substitution_map_id": "esm_0015",
    "exercise_id": "ex_cable_fly",
    "substitute_exercise_id": "ex_dumbbell_bench_press",
    "substitution_similarity": "same_pattern_and_primary_muscle",
    "reason": "Alternative with different equipment, stability, or joint-loading profile",
    "confidence_rating": "moderate"
  },
  {
    "exercise_substitution_map_id": "esm_0016",
    "exercise_id": "ex_cable_fly",
    "substitute_exercise_id": "ex_machine_chest_press",
    "substitution_similarity": "same_pattern_and_primary_muscle",
    "reason": "Alternative with different equipment, stability, or joint-loading profile",
    "confidence_rating": "moderate"
  },
  {
    "exercise_substitution_map_id": "esm_0017",
    "exercise_id": "ex_low_to_high_cable_fly",
    "substitute_exercise_id": "ex_incline_dumbbell_press",
    "substitution_similarity": "same_pattern_and_primary_muscle",
    "reason": "Alternative with different equipment, stability, or joint-loading profile",
    "confidence_rating": "moderate"
  },
  {
    "exercise_substitution_map_id": "esm_0018",
    "exercise_id": "ex_low_to_high_cable_fly",
    "substitute_exercise_id": "ex_incline_machine_press",
    "substitution_similarity": "same_pattern_and_primary_muscle",
    "reason": "Alternative with different equipment, stability, or joint-loading profile",
    "confidence_rating": "moderate"
  },
  {
    "exercise_substitution_map_id": "esm_0019",
    "exercise_id": "ex_overhead_press",
    "substitute_exercise_id": "ex_machine_shoulder_press",
    "substitution_similarity": "same_pattern_and_primary_muscle",
    "reason": "Alternative with different equipment, stability, or joint-loading profile",
    "confidence_rating": "moderate"
  },
  {
    "exercise_substitution_map_id": "esm_0020",
    "exercise_id": "ex_machine_shoulder_press",
    "substitute_exercise_id": "ex_overhead_press",
    "substitution_similarity": "same_pattern_and_primary_muscle",
    "reason": "Alternative with different equipment, stability, or joint-loading profile",
    "confidence_rating": "moderate"
  },
  {
    "exercise_substitution_map_id": "esm_0021",
    "exercise_id": "ex_cable_lateral_raise",
    "substitute_exercise_id": "ex_dumbbell_lateral_raise",
    "substitution_similarity": "same_pattern_and_primary_muscle",
    "reason": "Alternative with different equipment, stability, or joint-loading profile",
    "confidence_rating": "moderate"
  },
  {
    "exercise_substitution_map_id": "esm_0022",
    "exercise_id": "ex_cable_lateral_raise",
    "substitute_exercise_id": "ex_machine_lateral_raise",
    "substitution_similarity": "same_pattern_and_primary_muscle",
    "reason": "Alternative with different equipment, stability, or joint-loading profile",
    "confidence_rating": "moderate"
  },
  {
    "exercise_substitution_map_id": "esm_0023",
    "exercise_id": "ex_dumbbell_lateral_raise",
    "substitute_exercise_id": "ex_cable_lateral_raise",
    "substitution_similarity": "same_pattern_and_primary_muscle",
    "reason": "Alternative with different equipment, stability, or joint-loading profile",
    "confidence_rating": "moderate"
  },
  {
    "exercise_substitution_map_id": "esm_0024",
    "exercise_id": "ex_dumbbell_lateral_raise",
    "substitute_exercise_id": "ex_machine_lateral_raise",
    "substitution_similarity": "same_pattern_and_primary_muscle",
    "reason": "Alternative with different equipment, stability, or joint-loading profile",
    "confidence_rating": "moderate"
  },
  {
    "exercise_substitution_map_id": "esm_0025",
    "exercise_id": "ex_machine_lateral_raise",
    "substitute_exercise_id": "ex_cable_lateral_raise",
    "substitution_similarity": "same_pattern_and_primary_muscle",
    "reason": "Alternative with different equipment, stability, or joint-loading profile",
    "confidence_rating": "moderate"
  },
  {
    "exercise_substitution_map_id": "esm_0026",
    "exercise_id": "ex_machine_lateral_raise",
    "substitute_exercise_id": "ex_dumbbell_lateral_raise",
    "substitution_similarity": "same_pattern_and_primary_muscle",
    "reason": "Alternative with different equipment, stability, or joint-loading profile",
    "confidence_rating": "moderate"
  },
  {
    "exercise_substitution_map_id": "esm_0027",
    "exercise_id": "ex_pull_up",
    "substitute_exercise_id": "ex_chin_up",
    "substitution_similarity": "same_pattern_and_primary_muscle",
    "reason": "Alternative with different equipment, stability, or joint-loading profile",
    "confidence_rating": "moderate"
  },
  {
    "exercise_substitution_map_id": "esm_0028",
    "exercise_id": "ex_pull_up",
    "substitute_exercise_id": "ex_lat_pulldown",
    "substitution_similarity": "same_pattern_and_primary_muscle",
    "reason": "Alternative with different equipment, stability, or joint-loading profile",
    "confidence_rating": "moderate"
  },
  {
    "exercise_substitution_map_id": "esm_0029",
    "exercise_id": "ex_pull_up",
    "substitute_exercise_id": "ex_one_arm_cable_pulldown",
    "substitution_similarity": "same_pattern_and_primary_muscle",